{
  "$schema": "https://raw.githubusercontent.com/ashergarland/agent-tool-platform/main/packages/capability-registry/schemas/v1/capability-registry.schema.json",
  "schemaVersion": "1.2.0",
  "kind": "capability-registry",
  "registryVersion": "0.0.0-development",
  "capabilities": [
    {
      "$schema": "https://raw.githubusercontent.com/ashergarland/agent-tool-platform/main/packages/capability-registry/schemas/v1/capability-entry.schema.json",
      "schemaVersion": "1.2.0",
      "kind": "capability",
      "id": "ast-summarizer",
      "displayName": "AST Summarizer",
      "description": "Read-only TypeScript and JavaScript declaration skeletons and local dependency graphs for one workspace.",
      "publisher": {
        "id": "ashergarland",
        "displayName": "Asher Garland",
        "url": "https://github.com/ashergarland"
      },
      "version": {
        "value": "0.1.1",
        "status": "released"
      },
      "artifacts": [
        {
          "id": "npm-package",
          "identifier": "@agent-tool-platform/ast-summarizer",
          "version": "0.1.1",
          "availability": "published",
          "reference": "v0.1.1",
          "kind": "npm",
          "localExecution": {
            "schemaVersion": 1,
            "kind": "node-package-bin",
            "bin": "agent-tool-ast-summarizer",
            "integrity": "sha512-KLP86c/Ylp+oqCTVHuZdHwql2GX4Xfai59UEXUjWrFpzq/l1vMlMPWz44jFgXNaavAmiVl07y73oplVwnKXRxw==",
            "lifecycleScripts": "forbidden"
          }
        }
      ],
      "links": {
        "repository": "https://github.com/ashergarland/agent-tool-server-ast-summarizer",
        "documentation": "https://github.com/ashergarland/agent-tool-server-ast-summarizer#readme"
      },
      "category": {
        "id": "development",
        "displayName": "Development"
      },
      "tags": [
        "code",
        "context-optimization",
        "dependency-analysis",
        "typescript"
      ],
      "toolCount": 2,
      "profiles": [
        {
          "id": "local-package",
          "description": "Read-only local package execution over stdio against one TypeScript or JavaScript workspace.",
          "source": "registry-curated",
          "dimensions": {
            "execution": "local",
            "delivery": "package",
            "access": "local-process",
            "workload": "filesystem",
            "provider": "none",
            "mutation": "read-only"
          },
          "permissions": {
            "summary": "Read files beneath the configured workspace root.",
            "scopes": [
              "workspace-read"
            ]
          },
          "prerequisites": {
            "setupRequired": true,
            "summary": "Requires a local TypeScript or JavaScript workspace; no provider or secret setup is required.",
            "requiredSecrets": [],
            "provider": []
          },
          "readiness": {
            "signals": [
              "process",
              "workload"
            ],
            "summary": "Ready when the local process can read the configured workspace."
          },
          "stateEffects": []
        }
      ],
      "bindings": [
        {
          "id": "local-stdio",
          "profileId": "local-package",
          "artifactId": "npm-package",
          "interface": "stdio",
          "availability": "local"
        }
      ],
      "stateChanging": false,
      "routing": {
        "summary": "Use for TypeScript or JavaScript declarations, signatures, file skeletons, dependency structure, and codebase orientation."
      },
      "conformance": {
        "status": "partial",
        "checks": [
          "mcp-metadata",
          "routing-metadata",
          "runtime-contract"
        ]
      },
      "source": {
        "capabilityId": "io.github.ashergarland/agent-tool-server-ast-summarizer",
        "repository": "https://github.com/ashergarland/agent-tool-server-ast-summarizer",
        "revision": "93bffa78d3fbbb4d835a8da55f33af68e48ec8cd",
        "metadataVersion": "0.0.0-development",
        "releaseTag": "v0.1.1",
        "metadata": {
          "server": "server.json",
          "package": "package.json"
        }
      }
    },
    {
      "$schema": "https://raw.githubusercontent.com/ashergarland/agent-tool-platform/main/packages/capability-registry/schemas/v1/capability-entry.schema.json",
      "schemaVersion": "1.2.0",
      "kind": "capability",
      "id": "azure",
      "displayName": "Azure Agent Tool Server",
      "description": "Inspect, diagnose, operate and deploy Azure through a guard-railed control plane",
      "publisher": {
        "id": "ashergarland",
        "displayName": "Asher Garland",
        "url": "https://github.com/ashergarland"
      },
      "version": {
        "value": "0.3.0",
        "status": "released"
      },
      "artifacts": [
        {
          "id": "oci-container",
          "identifier": "ghcr.io/ashergarland/agent-tool-server-azure",
          "version": "0.3.0",
          "availability": "published",
          "reference": "v0.3.0",
          "kind": "oci"
        }
      ],
      "links": {
        "repository": "https://github.com/ashergarland/agent-tool-server-azure",
        "documentation": "https://github.com/ashergarland/agent-tool-server-azure#readme"
      },
      "category": {
        "id": "cloud",
        "displayName": "Cloud"
      },
      "tags": [
        "azure",
        "cloud",
        "diagnostics",
        "infrastructure",
        "operations"
      ],
      "toolCount": 18,
      "profiles": [
        {
          "id": "hosted-mutating",
          "description": "Authenticated hosted Azure operations with separately enabled mutations, previews, confirmation, scoped RBAC, and provider verification.",
          "source": "capability-profile-declaration",
          "dimensions": {
            "execution": "hosted",
            "delivery": "container",
            "access": "authenticated-service",
            "workload": "provider",
            "provider": "external",
            "mutation": "mutating"
          },
          "permissions": {
            "summary": "Read Azure state and perform only separately enabled, allow-listed operations within operator-scoped RBAC.",
            "scopes": [
              "network-access",
              "provider-read",
              "provider-write"
            ]
          },
          "prerequisites": {
            "setupRequired": true,
            "summary": "Requires an authenticated hosted service, operator-scoped Azure identities, provider registrations, and separately enabled mutation policy.",
            "requiredSecrets": [
              "connector-api-key"
            ],
            "provider": [
              {
                "id": "azure-provider-registrations",
                "description": "Every resource provider required by an authorized operation or Bicep template is registered by the operator."
              },
              {
                "id": "azure-resource-manager",
                "description": "Azure Resource Manager and Resource Graph are available to the selected managed identity."
              }
            ]
          },
          "readiness": {
            "signals": [
              "process",
              "provider",
              "workload"
            ],
            "summary": "Ready when hosted access, provider authentication, selected mutation RBAC, and deployment prerequisites are usable."
          },
          "stateEffects": [
            "provider-mutation"
          ]
        },
        {
          "id": "hosted-read-only",
          "description": "Authenticated hosted inspection and diagnosis through an operator-scoped Azure identity.",
          "source": "capability-profile-declaration",
          "dimensions": {
            "execution": "hosted",
            "delivery": "container",
            "access": "authenticated-service",
            "workload": "provider",
            "provider": "external",
            "mutation": "read-only"
          },
          "permissions": {
            "summary": "Read Azure state within operator-selected scopes and the managed identity's effective RBAC.",
            "scopes": [
              "network-access",
              "provider-read"
            ]
          },
          "prerequisites": {
            "setupRequired": true,
            "summary": "Requires an authenticated hosted service, an operator-scoped Azure identity, and required provider registrations.",
            "requiredSecrets": [
              "connector-api-key"
            ],
            "provider": [
              {
                "id": "azure-provider-registrations",
                "description": "Resource providers needed by the resources being inspected are registered by the operator."
              },
              {
                "id": "azure-resource-manager",
                "description": "Azure Resource Manager and Resource Graph are available to the selected managed identity."
              }
            ]
          },
          "readiness": {
            "signals": [
              "process",
              "provider",
              "workload"
            ],
            "summary": "Ready when hosted access, Azure authentication, a read-only provider query, and configured RBAC checks succeed."
          },
          "stateEffects": []
        }
      ],
      "bindings": [
        {
          "id": "hosted-mutating-http",
          "profileId": "hosted-mutating",
          "artifactId": "oci-container",
          "interface": "http",
          "availability": "remote",
          "client": {
            "http": {
              "headers": [
                {
                  "name": "x-api-key",
                  "value": {
                    "source": "configuration",
                    "name": "connector-api-key",
                    "prefix": ""
                  }
                }